{
  "id": "coronel-vivida",
  "nome": "Coronel Vivida",
  "links": {
    "site": "https://coronelvivida.ifpr.edu.br/",
    "calendario_academico": "https://ifpr.edu.br/coronel-vivida/academico/calendario-academico/"
  },
  "horario_aulas": {
    "coletado_em": "2026-05-14T11:48:00-03:00",
    "url": "https://ifpr.edu.br/coronel-vivida/horarios-de-atendimento/"
  },
  "cursos": [
    {
      "curso_slug": "tecnico-em-administracao",
      "notion_page_id": "6b5c2da1-4048-8322-b8c6-0186e35cccaf",
      "nome": "Técnico em Administração",
      "nivel": "médio",
      "tipo_oferta": "integrado",
      "url": "https://ifpr.edu.br/coronel-vivida/nossos-cursos/tecnicos-integrados/tecnico-administracao/",
      "modalidade": "presencial",
      "situacao": "ativo",
      "suap": {
        "id": 59,
        "codigo": "CV001",
        "vagas": 40,
        "coletado_em": "2026-05-25T00:00:00-03:00",
        "atualizado_em": "2026-05-25T00:00:00-03:00"
      },
      "ppc": {
        "url": "https://ifpr.edu.br/coronel-vivida/wp-content/uploads/sites/10/2026/05/PPC-ADM-VERSAO-FINAL-09.12.2025.pdf",
        "conversao": {
          "status": "convertido"
        },
        "markdown_path": "institucional/ifpr/ppcs/coronel-vivida/tecnico-em-administracao.md",
        "metadados": {
          "ano_documento": {
            "ano": 2025,
            "trecho_fonte": "Ano do documento registrado no Notion: 2025",
            "status_curadoria": "precisa_revisao"
          },
          "vagas": {
            "quantidade": 40,
            "trecho_fonte": "Vagas totais Quarenta vagas. 7",
            "status_curadoria": "precisa_revisao"
          }
        }
      },
      "sei": {
        "processos": [
          {
            "numero": "23411.018449/2024-73",
            "tipo": "Ajuste PPC",
            "trecho_fonte": "Revisado em 26/05/26 via sei-cli. Origem: https://docs.google.com/spreadsheets/d/1ZyZkQIWHRlaMyiYj9RbO1UofhgZJTmZuMZtr2kMTs2A/edit?gid=732417574#gid=732417574, aba TAREFAS e ATIVIDADES, linha 51. Aprovado Consepe"
          }
        ]
      }
    },
    {
      "curso_slug": "tecnico-em-cooperativismo",
      "notion_page_id": "75bc2da1-4048-83e4-8b84-01d61595e98d",
      "nome": "Técnico em Cooperativismo",
      "nivel": "médio",
      "tipo_oferta": "integrado",
      "url": "https://ifpr.edu.br/coronel-vivida/nossos-cursos/tecnicos-integrados/cooperativismo/",
      "modalidade": "presencial",
      "situacao": "ativo",
      "suap": {
        "id": 120,
        "codigo": "CV002",
        "vagas": 40,
        "coletado_em": "2026-05-25T00:00:00-03:00",
        "atualizado_em": "2026-05-25T00:00:00-03:00"
      },
      "ppc": {
        "url": "https://ifpr.edu.br/coronel-vivida/wp-content/uploads/sites/10/2026/05/PPC-COOP-VERSAO-FINAL-09.12.2025.pdf",
        "conversao": {
          "status": "convertido"
        },
        "markdown_path": "institucional/ifpr/ppcs/coronel-vivida/tecnico-em-cooperativismo.md",
        "metadados": {
          "ano_documento": {
            "ano": 2025,
            "trecho_fonte": "Ano do documento registrado no Notion: 2025",
            "status_curadoria": "precisa_revisao"
          },
          "vagas": {
            "quantidade": 40,
            "trecho_fonte": "Vagas totais 40 vagas",
            "status_curadoria": "precisa_revisao"
          }
        }
      },
      "sei": {
        "processos": [
          {
            "numero": "23411.018207/2024-80",
            "tipo": "Ajuste PPC",
            "trecho_fonte": "Revisado em 26/05/26 via sei-cli. Origem: https://docs.google.com/spreadsheets/d/1ZyZkQIWHRlaMyiYj9RbO1UofhgZJTmZuMZtr2kMTs2A/edit?gid=732417574#gid=732417574, aba TAREFAS e ATIVIDADES, linha 52. Aprovado Consepe"
          }
        ]
      }
    },
    {
      "curso_slug": "tecnologia-em-gestao-financeira",
      "notion_page_id": "7c4c2da1-4048-833b-a1e6-8155cad67db4",
      "nome": "Tecnologia em Gestão Financeira",
      "nivel": "superior",
      "tipo_oferta": "graduação tecnológica",
      "url": "https://ifpr.edu.br/coronel-vivida/nossos-cursos/graduacao/tecnologia-em-gestao-financeira/",
      "modalidade": "presencial",
      "situacao": "ativo",
      "ppc": {
        "url": "https://ifpr.edu.br/coronel-vivida/wp-content/uploads/sites/10/2025/12/PPC_TECNOLOGO_EM_GESTAO_FINANCEIRA_atualizacao_12-2025.pdf",
        "conversao": {
          "status": "convertido"
        },
        "markdown_path": "institucional/ifpr/ppcs/coronel-vivida/tecnologia-em-gestao-financeira.md",
        "metadados": {
          "ano_documento": {
            "ano": 2025,
            "trecho_fonte": "Ano do documento registrado no Notion: 2025",
            "status_curadoria": "precisa_revisao"
          }
        }
      }
    }
  ]
}
