{
  "id": "astorga",
  "nome": "Astorga",
  "links": {
    "site": "https://astorga.ifpr.edu.br/",
    "calendario_academico": "https://ifpr.edu.br/astorga/estudantes/calendario-academico/"
  },
  "horario_aulas": {
    "coletado_em": "2026-05-14T11:48:00-03:00",
    "url": "https://ifpr.edu.br/astorga/horarios-de-aula/"
  },
  "cursos": [
    {
      "curso_slug": "curso-tecnico-de-informatica-integrado-ao-ensino-medio",
      "notion_page_id": "dc2c2da1-4048-834b-86c5-016c2a5280c3",
      "nome": "Técnico em Informática",
      "nivel": "médio",
      "tipo_oferta": "integrado",
      "url": "https://ifpr.edu.br/astorga/menu-principal/nossos-cursos/tecnicos-integrados/tinfem/",
      "modalidade": "presencial",
      "situacao": "ativo",
      "suap": {
        "id": 56,
        "codigo": "AST002",
        "vagas": 40,
        "coletado_em": "2026-05-25T00:00:00-03:00",
        "atualizado_em": "2026-05-25T00:00:00-03:00"
      },
      "ppc": {
        "url": "https://ifpr.edu.br/astorga/wp-content/uploads/sites/4/2017/11/PPC-Tecnico-em-Informatica-Integrado-ao-Ensino-Medio-Astorga-2018.pdf",
        "conversao": {
          "status": "convertido"
        },
        "markdown_path": "institucional/ifpr/ppcs/astorga/curso-tecnico-de-informatica-integrado-ao-ensino-medio.md",
        "metadados": {
          "ano_documento": {
            "ano": 2010,
            "trecho_fonte": "Ano do documento registrado no Notion: 2010",
            "status_curadoria": "precisa_revisao"
          },
          "vagas": {
            "quantidade": 40,
            "trecho_fonte": "Número máximo de vagas do curso: 40 vagas Número mínimo de vagas do curso: 30 vagas",
            "status_curadoria": "precisa_revisao",
            "minimo": 30,
            "maximo": 40
          }
        }
      }
    },
    {
      "curso_slug": "licenciatura-em-pedagogia",
      "notion_page_id": "574c2da1-4048-834d-b6a8-01148629a882",
      "nome": "Licenciatura em Pedagogia",
      "nivel": "superior",
      "tipo_oferta": "licenciatura",
      "url": "https://ifpr.edu.br/astorga/menu-principal/nossos-cursos/pedagogia/",
      "modalidade": "presencial",
      "situacao": "ativo",
      "ppc": {
        "url": "https://ifpr.edu.br/astorga/wp-content/uploads/sites/4/2026/02/PPC-PEDAGOGIA-2025.pdf",
        "conversao": {
          "status": "convertido"
        },
        "markdown_path": "institucional/ifpr/ppcs/astorga/licenciatura-em-pedagogia.md",
        "metadados": {
          "ano_documento": {
            "ano": 2023,
            "trecho_fonte": "Ano do documento registrado no Notion: 2023",
            "status_curadoria": "precisa_revisao"
          },
          "vagas": {
            "quantidade": 20,
            "trecho_fonte": "Vagas totais (anual) 20 vagas (mínimo) a 40 vagas (máximo)",
            "status_curadoria": "precisa_revisao",
            "periodicidade": "anual"
          }
        }
      }
    },
    {
      "curso_slug": "tecnico-em-desenvolvimento-de-sistemas",
      "notion_page_id": "c3fc2da1-4048-8298-b474-81f6eddaf690",
      "nome": "Técnico em Desenvolvimento de Sistemas",
      "nivel": "médio",
      "tipo_oferta": "subsequente",
      "url": "https://ifpr.edu.br/astorga/menu-principal/nossos-cursos/tecnicos-subsequentes/tecnico-em-desenvolvimento-de-sistemas-tads/",
      "modalidade": "presencial",
      "situacao": "suspenso",
      "suap": {
        "id": 48,
        "codigo": "AST001",
        "vagas": 40,
        "coletado_em": "2026-05-25T00:00:00-03:00",
        "atualizado_em": "2026-05-25T00:00:00-03:00"
      },
      "ppc": {
        "url": "https://ifpr.edu.br/astorga/wp-content/uploads/sites/4/2022/10/NOVO_PPC_Subsequente_1200_horas_relogio.docx__4.pdf",
        "conversao": {
          "status": "convertido"
        },
        "markdown_path": "institucional/ifpr/ppcs/astorga/tecnico-em-desenvolvimento-de-sistemas.md",
        "metadados": {
          "ano_documento": {
            "ano": 2022,
            "trecho_fonte": "Ano do documento registrado no Notion: 2022",
            "status_curadoria": "precisa_revisao"
          },
          "vagas": {
            "quantidade": 40,
            "trecho_fonte": "Número máximo de vagas do curso: 40 Número mínimo de vagas do curso: 30 INSTITUTO FEDERAL DO PARANÁ Pró-Reitoria de Ensino - PROENS Av. Victor Ferreira",
            "status_curadoria": "precisa_revisao",
            "minimo": 30,
            "maximo": 40
          }
        }
      },
      "sei": {
        "processos": [
          {
            "numero": "23411.009814/2024-59",
            "tipo": "Abertura - PAC"
          },
          {
            "numero": "23411.011762/2025-61",
            "tipo": "Suspensão",
            "trecho_fonte": "Revisado em 26/05/26 via sei-cli. Origem: https://docs.google.com/spreadsheets/d/1ZyZkQIWHRlaMyiYj9RbO1UofhgZJTmZuMZtr2kMTs2A/edit?gid=732417574#gid=732417574, aba TAREFAS e ATIVIDADES, linha 42. Aprovado Consepe"
          }
        ]
      }
    }
  ]
}
