{
  "id": "quedas-do-iguacu",
  "nome": "Quedas do Iguaçu",
  "links": {
    "site": "https://quedasdoiguacu.ifpr.edu.br/",
    "calendario_academico": "https://ifpr.edu.br/quedas-do-iguacu/academico/calendario/"
  },
  "horario_aulas": {
    "coletado_em": "2026-05-14T11:48:00-03:00"
  },
  "cursos": [
    {
      "curso_slug": "tecnico-em-informatica",
      "notion_page_id": "a24c2da1-4048-834f-abb9-81fe41d253c8",
      "nome": "Técnico em Informática",
      "nivel": "médio",
      "tipo_oferta": "integrado",
      "url": "https://ifpr.edu.br/quedas-do-iguacu/medio-integrado-2/tecnico-em-informatica/",
      "modalidade": "presencial",
      "situacao": "ativo",
      "suap": {
        "id": 170,
        "codigo": "QUED001",
        "vagas": 40,
        "coletado_em": "2026-05-25T00:00:00-03:00",
        "atualizado_em": "2026-05-25T00:00:00-03:00"
      },
      "ppc": {
        "url": "https://ifpr.edu.br/quedas-do-iguacu/wp-content/uploads/sites/24/2024/04/2_PPC-INFORMATICA_3-ANOS_VERSAO-APROVADA_AGOSTO-2018-2.pdf",
        "conversao": {
          "status": "convertido"
        },
        "markdown_path": "institucional/ifpr/ppcs/quedas-do-iguacu/tecnico-em-informatica.md",
        "metadados": {
          "ano_documento": {
            "ano": 2018,
            "trecho_fonte": "Ano do documento registrado no Notion: 2018",
            "status_curadoria": "precisa_revisao"
          },
          "vagas": {
            "quantidade": 40,
            "trecho_fonte": "Número máximo de vagas do curso: 40 Número mínimo de vagas do curso: 20",
            "status_curadoria": "precisa_revisao",
            "minimo": 20,
            "maximo": 40
          }
        }
      }
    },
    {
      "curso_slug": "tecnico-em-meio-ambiente",
      "notion_page_id": "f12c2da1-4048-8328-ac8c-01c9a90c6e01",
      "nome": "Técnico em Meio Ambiente",
      "nivel": "médio",
      "tipo_oferta": "integrado",
      "url": "https://ifpr.edu.br/quedas-do-iguacu/medio-integrado-2/tecnico-em-meio-ambiente/",
      "modalidade": "presencial",
      "situacao": "ativo",
      "suap": {
        "id": 197,
        "codigo": "QUED002",
        "vagas": 40,
        "coletado_em": "2026-05-25T00:00:00-03:00",
        "atualizado_em": "2026-05-25T00:00:00-03:00"
      },
      "ppc": {
        "url": "https://ifpr.edu.br/quedas-do-iguacu/wp-content/uploads/sites/24/2023/05/PPC_Meio_Ambiente.pdf",
        "conversao": {
          "status": "convertido"
        },
        "markdown_path": "institucional/ifpr/ppcs/quedas-do-iguacu/tecnico-em-meio-ambiente.md",
        "metadados": {
          "ano_documento": {
            "ano": 2019,
            "trecho_fonte": "Ano do documento registrado no Notion: 2019",
            "status_curadoria": "precisa_revisao"
          },
          "vagas": {
            "quantidade": 40,
            "trecho_fonte": "Número máximo de vagas do curso: 40 Número mínimo de vagas do curso: 20",
            "status_curadoria": "precisa_revisao",
            "minimo": 20,
            "maximo": 40
          }
        }
      },
      "sei": {
        "processos": [
          {
            "numero": "23398.001956/2017-64",
            "tipo": "abertura OLD",
            "trecho_fonte": "Revisado em 27/05/26 via sei-cli e PPC convertido.\n\nEvidências\n- PPC: O Conselho Superior do Instituto Federal de Educação, Ciência e Tecnologia do Paraná, no uso de suas atribuições legais e estatutárias, considerando o Parecer nº 17/2019 do Conselho de Ensino, Pesquisa e Extensão e o Parecer do Conselheiro Paulo Vasconcelos de Medeiros contido no processo 23398.001956/2017-64,\n- Tipo no SEI: Ensino: Proposta de Abertura de Curso.\n- Especificação no SEI: Proposta - Abertura de Curso - Técnico em Meio Ambiente.\n- Data Última mov.: 16/01/24."
          }
        ]
      }
    }
  ]
}
